{
  "schemaVersion": 1,
  "generatedOn": "2026-08-26",
  "overview": {
    "title": "TurboWarp extension and toolchain overview",
    "centralPath": "docs/developer-guides/turbowarp-ecosystem.md",
    "rationale": "Scratchでの創作からTypeScriptの機能拡張、Composition API、SB3の再現可能なbuild、TurboWarp-Kamishibaiの統合applicationまでを一つの道筋として説明する。",
    "learningPath": [
      "Scratchでの創作",
      "TurboWarpと既存機能拡張の利用",
      "TypeScriptによる独自機能拡張",
      "Composition APIによる機能の合成",
      "SB3のsource管理と再現可能なbuild",
      "TurboWarp-Kamishibaiという統合application"
    ]
  },
  "repositories": [
    {
      "id": "turbowarp-tm",
      "category": "recognition-input-network",
      "productName": "TurboWarp TM",
      "responsibility": "カメラ由来の姿勢・動作状態をTurboWarp blockとComposition APIへ渡す。",
      "surface": ["Standalone extension", "Composition API"],
      "inputs": ["camera frame", "pose model output"],
      "outputs": ["motion state", "TM events"],
      "dependencies": ["turbowarp-camera-source"],
      "optionalIntegrations": ["turbowarp-async-input", "turbowarp-kamishibai-app"],
      "useCase": "身体の動きで紙芝居やScratch作品を進める。",
      "packageName": "@kubohiroya/turbowarp-tm",
      "repository": "kubohiroya/turbowarp-tm",
      "guideUrl": "https://github.com/kubohiroya/turbowarp-tm#readme",
      "licensePolicy": "MPL-2.0 for software.",
      "status": "current",
      "extensionId": "kubohiroyatm"
    },
    {
      "id": "turbowarp-camera-source",
      "category": "recognition-input-network",
      "productName": "TurboWarp-Camera-Source",
      "responsibility": "ブラウザーのカメラ入力を他の機能拡張が扱える映像sourceとして提供する。",
      "surface": ["Standalone extension", "Composition API"],
      "inputs": ["MediaDevices camera stream"],
      "outputs": ["video frame source"],
      "dependencies": [],
      "optionalIntegrations": ["turbowarp-tm", "turbowarp-jsqr"],
      "useCase": "認識系拡張へ共通のカメラ入力を渡す。",
      "packageName": "@kubohiroya/turbowarp-camera-source",
      "repository": "kubohiroya/turbowarp-camera-source",
      "guideUrl": "https://github.com/kubohiroya/turbowarp-camera-source#readme",
      "licensePolicy": "MPL-2.0 for software.",
      "status": "current"
    },
    {
      "id": "turbowarp-jsqr",
      "category": "recognition-input-network",
      "productName": "TurboWarp jsQR",
      "responsibility": "カメラ画像からQR codeを読み取り、作品内の入力として扱う。",
      "surface": ["Standalone extension", "Composition API"],
      "inputs": ["video frame source"],
      "outputs": ["QR payload"],
      "dependencies": ["turbowarp-camera-source"],
      "optionalIntegrations": ["turbowarp-kamishibai-app"],
      "useCase": "会場や教材でQR codeから作品・台本・設定を選ぶ。",
      "packageName": "@kubohiroya/turbowarp-jsqr",
      "repository": "kubohiroya/turbowarp-jsqr",
      "guideUrl": "https://github.com/kubohiroya/turbowarp-jsqr#readme",
      "licensePolicy": "MPL-2.0 for software.",
      "status": "current"
    },
    {
      "id": "turbowarp-webusb-pasori",
      "category": "recognition-input-network",
      "productName": "TurboWarp-WebUSB-Pasori",
      "responsibility": "PaSoRiなどのWebUSB機器から読み取った入力をTurboWarpへ接続する。",
      "surface": ["Standalone extension", "Composition API"],
      "inputs": ["WebUSB device data"],
      "outputs": ["device input event"],
      "dependencies": [],
      "optionalIntegrations": ["turbowarp-async-input"],
      "useCase": "カードや外部デバイスで作品の分岐を操作する。",
      "packageName": "@kubohiroya/turbowarp-webusb-pasori",
      "repository": "kubohiroya/turbowarp-webusb-pasori",
      "guideUrl": "https://github.com/kubohiroya/turbowarp-webusb-pasori#readme",
      "licensePolicy": "MPL-2.0 for software.",
      "status": "current"
    },
    {
      "id": "turbowarp-async-input",
      "category": "recognition-input-network",
      "productName": "TurboWarp-Async-Input",
      "responsibility": "非同期の入力eventを一時保持し、Scratch/TurboWarpの実行tickから参照できる形へ整える。",
      "surface": ["Standalone extension", "Composition API"],
      "inputs": ["TM event", "device event", "application event"],
      "outputs": ["queued input state"],
      "dependencies": [],
      "optionalIntegrations": [
        "turbowarp-tm",
        "turbowarp-webusb-pasori",
        "turbowarp-kamishibai-app"
      ],
      "useCase": "複数入力を作品側の分岐条件へ安定して渡す。",
      "packageName": "@kubohiroya/turbowarp-async-input",
      "repository": "kubohiroya/turbowarp-async-input",
      "guideUrl": "https://github.com/kubohiroya/turbowarp-async-input#readme",
      "licensePolicy": "MPL-2.0 for software.",
      "status": "current"
    },
    {
      "id": "turbowarp-extended-notification",
      "category": "recognition-input-network",
      "productName": "TurboWarp-Extended-Notification",
      "responsibility": "作品やhost applicationから利用する通知・状態表示の入口を提供する。",
      "surface": ["Standalone extension", "Composition API"],
      "inputs": ["message request", "status request"],
      "outputs": ["notification UI state"],
      "dependencies": [],
      "optionalIntegrations": ["turbowarp-kamishibai-app"],
      "useCase": "入力待ち、完了、警告を作品利用者に伝える。",
      "packageName": "@kubohiroya/turbowarp-extended-notification",
      "repository": "kubohiroya/turbowarp-extended-notification",
      "guideUrl": "https://github.com/kubohiroya/turbowarp-extended-notification#readme",
      "licensePolicy": "MPL-2.0 for software.",
      "status": "current"
    },
    {
      "id": "turbowarp-webrtc",
      "category": "recognition-input-network",
      "productName": "TurboWarp WebRTC",
      "responsibility": "ブラウザー間通信を作品やapplicationの入力・同期経路として扱う。",
      "surface": ["Standalone extension", "Composition API"],
      "inputs": ["WebRTC message"],
      "outputs": ["peer message event"],
      "dependencies": [],
      "optionalIntegrations": ["turbowarp-kamishibai-app"],
      "useCase": "複数端末を使う作品や会場運用で状態を共有する。",
      "packageName": "@kubohiroya/turbowarp-webrtc",
      "repository": "kubohiroya/turbowarp-webrtc",
      "guideUrl": "https://github.com/kubohiroya/turbowarp-webrtc#readme",
      "licensePolicy": "MPL-2.0 for software.",
      "status": "current"
    },
    {
      "id": "turbowarp-named-data",
      "category": "state-assets",
      "productName": "TurboWarp Named Data",
      "responsibility": "namespace、name、kind、scopeで参照する共有data contractとprovider registryを提供する。",
      "surface": ["Standalone extension", "Composition API"],
      "inputs": ["named-data reference", "provider registration"],
      "outputs": ["metadata", "byte or stream body"],
      "dependencies": [],
      "optionalIntegrations": ["turbowarp-asset-cache"],
      "useCase": "複数の機能拡張から同じnamed resourceをcopyせず参照する。",
      "packageName": "@kubohiroya/turbowarp-named-data",
      "repository": "kubohiroya/turbowarp-named-data",
      "guideUrl": "https://github.com/kubohiroya/turbowarp-named-data#readme",
      "licensePolicy": "MPL-2.0 for software.",
      "status": "current"
    },
    {
      "id": "turbowarp-asset-cache",
      "category": "state-assets",
      "productName": "TurboWarp Asset Cache",
      "responsibility": "画像・音声・runtime textなどのasset参照、描画・再生、検証済みcacheを管理する。",
      "surface": ["Standalone extension", "Composition API"],
      "inputs": ["asset URL", "asset manifest"],
      "outputs": ["resolved asset", "asset loading state"],
      "dependencies": ["turbowarp-named-data"],
      "optionalIntegrations": [
        "turbowarp-bubble",
        "turbowarp-svg-text",
        "turbowarp-kamishibai-app"
      ],
      "useCase": "作品の場面や台詞に対応する素材を再現可能に読み込む。",
      "packageName": "@kubohiroya/turbowarp-asset-cache",
      "repository": "kubohiroya/turbowarp-asset-cache",
      "guideUrl": "https://github.com/kubohiroya/turbowarp-asset-cache#readme",
      "licensePolicy": "MPL-2.0 for software.",
      "status": "current"
    },
    {
      "id": "turbowarp-kvs",
      "category": "state-assets",
      "productName": "TurboWarp KVS",
      "responsibility": "namespace、key、binary valueとsession binary backingを永続化する。",
      "surface": ["Standalone extension", "Composition API"],
      "inputs": ["namespace", "key", "binary value"],
      "outputs": ["stored value", "session binary backing"],
      "dependencies": [],
      "optionalIntegrations": ["turbowarp-asset-cache", "turbowarp-kamishibai-app"],
      "useCase": "asset本体とは独立したbinary stateをsessionまたは永続storageへ保存する。",
      "packageName": "@kubohiroya/turbowarp-kvs",
      "repository": "kubohiroya/turbowarp-kvs",
      "guideUrl": "https://github.com/kubohiroya/turbowarp-kvs#readme",
      "licensePolicy": "MPL-2.0 for software.",
      "status": "current"
    },
    {
      "id": "turbowarp-text-lines",
      "category": "state-assets",
      "productName": "TurboWarp-Text-Lines",
      "responsibility": "複数行の台詞・文章を作品から扱いやすい単位へ分割し、順番に参照できるようにする。",
      "surface": ["Standalone extension", "Composition API"],
      "inputs": ["text asset", "line selection"],
      "outputs": ["line text", "cursor state"],
      "dependencies": [],
      "optionalIntegrations": ["turbowarp-bubble", "turbowarp-kamishibai-app"],
      "useCase": "紙芝居の台詞を一行ずつ表示・進行する。",
      "packageName": "@kubohiroya/turbowarp-text-lines",
      "repository": "kubohiroya/turbowarp-text-lines",
      "guideUrl": "https://github.com/kubohiroya/turbowarp-text-lines#readme",
      "licensePolicy": "MPL-2.0 for software.",
      "status": "current"
    },
    {
      "id": "turbowarp-runtime-expression",
      "category": "state-assets",
      "productName": "TurboWarp-Runtime-Expression",
      "responsibility": "application runtimeの値を式として参照・評価し、台本やblockの条件分岐へ接続する。",
      "surface": ["Standalone extension", "Composition API"],
      "inputs": ["runtime variable", "expression"],
      "outputs": ["evaluated value"],
      "dependencies": [],
      "optionalIntegrations": ["turbowarp-kamishibai-app"],
      "useCase": "台本変数とTurboWarpの状態を同じ条件判断に使う。",
      "packageName": "@kubohiroya/turbowarp-runtime-expression",
      "repository": "kubohiroya/turbowarp-runtime-expression",